{
  "object_id": "obj_demo_pdf",
  "object_type": "pgo_pdf_report",
  "schema_version": "1.0.0",
  "revision": 1,
  "created_at": "2026-09-17T16:10:00Z",
  "created_by": "pgp_report_studio",
  "input_refs": [
    {
      "object_id": "obj_demo_form_final_report",
      "revision": 1
    },
    {
      "object_id": "obj_demo_order",
      "revision": 1
    },
    {
      "object_id": "obj_demo_interactive",
      "revision": 1
    }
  ],
  "data": {
    "title": "Pocket Genes demonstration genomic report",
    "report_kind": "final_genomic",
    "language": "en",
    "subject_id": "subject_demo_001",
    "order_ref": {
      "object_id": "obj_demo_order",
      "revision": 1
    },
    "source_pgi1_ref": {
      "object_id": "obj_demo_interactive",
      "revision": 1
    },
    "created_by_provider_id": "pgp_report_studio",
    "generated_at": "2026-09-17T16:10:00Z",
    "page_count": 1,
    "status": "final",
    "template_id": "pg_demo_report_v1"
  },
  "files": [
    {
      "role": "primary",
      "path": "payloads/demo-report.pdf",
      "media_type": "application/pdf",
      "sha256": "cddb432eb94be2f1ad212a73488bf17a2be9ebb2335bf835023ceb89783e72f7",
      "size_bytes": 44812
    }
  ]
}
