{
  "object_id": "obj_demo_consultation_pdf",
  "object_type": "pgo_pdf_report",
  "schema_version": "1.0.0",
  "revision": 1,
  "created_at": "2026-09-16T12:05:00Z",
  "created_by": "pgp_clinical_planning",
  "input_refs": [
    {
      "object_id": "obj_demo_form_form_to_pdf",
      "revision": 1
    }
  ],
  "data": {
    "title": "Fictional consultation summary",
    "report_kind": "assessment",
    "language": "en",
    "subject_id": "subject_demo_001",
    "created_by_provider_id": "pgp_clinical_planning",
    "generated_at": "2026-09-16T12:05:00Z",
    "page_count": 1,
    "status": "final",
    "template_id": "pg_demo_report_v1"
  },
  "files": [
    {
      "role": "primary",
      "path": "payloads/demo-form-report.pdf",
      "media_type": "application/pdf",
      "sha256": "8b12f7a9d5f7c38233e3e970b9a2f36188ee681306ef7b7f809fcdceef4ddb4c",
      "size_bytes": 43883
    }
  ]
}
